{
  "$schema": "https://json-schema.org/draft/2020-12/schema",
  "$id": "https://vibecode.local/content-schemas/reference_build.json",
  "type": "object",
  "additionalProperties": false,
  "required": [
    "id",
    "kind",
    "displayName",
    "displayNameKey",
    "branchId",
    "statPriority",
    "identityKey"
  ],
  "properties": {
    "id": { "$ref": "https://vibecode.local/content-schemas/common.json#/$defs/contentId" },
    "kind": { "const": "reference_build" },
    "displayName": { "type": "string", "minLength": 1 },
    "displayNameKey": { "type": "string", "minLength": 1 },
    "descriptionKey": { "type": "string", "minLength": 1 },
    "branchId": { "$ref": "https://vibecode.local/content-schemas/common.json#/$defs/contentId" },
    "statPriority": {
      "type": "array",
      "minItems": 1,
      "items": { "$ref": "https://vibecode.local/content-schemas/common.json#/$defs/contentId" }
    },
    "identityKey": { "type": "string", "minLength": 1 },
    "pairedNodeIds": {
      "type": "array",
      "items": { "$ref": "https://vibecode.local/content-schemas/common.json#/$defs/contentId" }
    },
    "classification": { "$ref": "https://vibecode.local/content-schemas/common.json#/$defs/contentClassification" },
    "schemaVersion": { "$ref": "https://vibecode.local/content-schemas/common.json#/$defs/definitionSchemaVersion" },
    "developmentOnly": { "$ref": "https://vibecode.local/content-schemas/common.json#/$defs/developmentOnly" }
  }
}
