{
  "id": "build.berserker.hurricane",
  "kind": "reference_build",
  "displayName": "Hurricane",
  "displayNameKey": "build.berserker.hurricane.display_name",
  "descriptionKey": "build.berserker.hurricane.description",
  "branchId": "branch.warrior.berserker",
  "statPriority": [
    "stat.strength",
    "stat.haste",
    "stat.vitality"
  ],
  "identityKey": "build.berserker.hurricane.identity",
  "pairedNodeIds": [
    "talent.warrior.berserker.relentless"
  ],
  "classification": "canonical"
}
